word,definition,pos,cefr_level,theme,example_sentence,difficulty,word_type
borrow,To take something from someone and give it back later,verb,A2,Daily Life,Can I _ your pen for a moment?,2,vocabulary
neighbour,A person who lives next to you or near you,noun,A2,People & Relationships,Our friendly _ helped us carry the boxes.,2,vocabulary
breakfast,The first meal you eat in the morning,noun,A2,Daily Life,She had eggs and toast for _.,1,vocabulary
tired,Needing rest or sleep,adjective,A2,Health & Body,After the long walk I felt very _.,1,vocabulary
arrive,To reach a place,verb,A2,Travel & Places,The train will _ at the station soon.,2,vocabulary
